{
  "name": "Online cake batticaloa",
  "coordinates": {
    "latitude": 7.706671099999999,
    "longitude": 81.6978044
  },
  "address": "7 Muhandiram Rd, Batticaloa",
  "categories": [
    "Bakery"
  ],
  "phone": "0775026556",
  "hours": [
    {
      "day": "Monday",
      "times": [
        "Open 24 hours"
      ]
    },
    {
      "day": "Tuesday",
      "times": [
        "Open 24 hours"
      ]
    },
    {
      "day": "Wednesday",
      "times": [
        "Open 24 hours"
      ]
    },
    {
      "day": "Thursday",
      "times": [
        "Open 24 hours"
      ]
    },
    {
      "day": "Friday",
      "times": [
        "Open 24 hours"
      ]
    },
    {
      "day": "Saturday",
      "times": [
        "Open 24 hours"
      ]
    },
    {
      "day": "Sunday",
      "times": [
        "Open 24 hours"
      ]
    }
  ],
  "business_status": "OPEN",
  "id": "01M5W5PQHV7GV6AJY6ZKWRDGV5"
}
