{
  "name": "Si jewellery",
  "coordinates": {
    "latitude": 7.679415,
    "longitude": 81.73764589999999
  },
  "address": "MPHQ+R2C, Kattankudy",
  "categories": [
    "Jewelry store"
  ],
  "phone": "0773733067",
  "hours": [
    {
      "day": "Monday",
      "times": [
        "9 AM–9 PM"
      ]
    },
    {
      "day": "Tuesday",
      "times": [
        "9 AM–9 PM"
      ]
    },
    {
      "day": "Wednesday",
      "times": [
        "9 AM–9 PM"
      ]
    },
    {
      "day": "Thursday",
      "times": [
        "9 AM–9 PM"
      ]
    },
    {
      "day": "Friday",
      "times": [
        "Closed"
      ]
    },
    {
      "day": "Saturday",
      "times": [
        "9 AM–9 PM"
      ]
    },
    {
      "day": "Sunday",
      "times": [
        "9 AM–9 PM"
      ]
    }
  ],
  "business_status": "OPEN",
  "id": "01M5W5PQTYMYQSJ6VQ7MRSAGB1"
}
