{
  "name": "The Liya Cafe & Restaurant",
  "coordinates": {
    "latitude": 7.7180579,
    "longitude": 81.7088448
  },
  "address": "Batticaloa Main Street Singing fish park complex Batticaloa kallady near kallady bridge Batticaloa, Kallady 30000",
  "categories": [
    "Fast food restaurant",
    "Hamburger restaurant",
    "Indian restaurant",
    "Sri Lankan restaurant"
  ],
  "phone": "0652226862",
  "hours": [
    {
      "day": "Monday",
      "times": [
        "12 PM–1 AM"
      ]
    },
    {
      "day": "Tuesday",
      "times": [
        "12 PM–1 AM"
      ]
    },
    {
      "day": "Wednesday",
      "times": [
        "12 PM–1 AM"
      ]
    },
    {
      "day": "Thursday",
      "times": [
        "12 PM–1 AM"
      ]
    },
    {
      "day": "Friday",
      "times": [
        "12 PM–1 AM"
      ]
    },
    {
      "day": "Saturday",
      "times": [
        "12 PM–1 AM"
      ]
    },
    {
      "day": "Sunday",
      "times": [
        "12 PM–1 AM"
      ]
    }
  ],
  "website": "https://www.facebook.com/profile.php?id=61550335598989&mibextid=LQQJ4d",
  "business_status": "OPEN",
  "id": "01M5W5PQYCJP1ZQS3W1B8PHKC5"
}
