{
  "name": "முத்துலிங்கப் பிள்ளையார் கோயில்",
  "coordinates": {
    "latitude": 7.595179399999999,
    "longitude": 81.7273087
  },
  "categories": [
    "Hindu temple"
  ],
  "address": "HPWG+3WF, West",
  "phone": "0759490869",
  "business_status": "OPEN",
  "hours": [
    {
      "day": "Monday",
      "times": [
        "Open 24 hours"
      ]
    },
    {
      "day": "Tuesday",
      "times": [
        "Open 24 hours"
      ]
    },
    {
      "day": "Wednesday",
      "times": [
        "Open 24 hours"
      ]
    },
    {
      "day": "Thursday",
      "times": [
        "Open 24 hours"
      ]
    },
    {
      "day": "Friday",
      "times": [
        "Open 24 hours"
      ]
    },
    {
      "day": "Saturday",
      "times": [
        "Open 24 hours"
      ]
    },
    {
      "day": "Sunday",
      "times": [
        "Open 24 hours"
      ]
    }
  ],
  "id": "01M5Z5A6T9JN2EXPG70FTCYM8Z"
}
