{
  "name": "Green Park Lanka",
  "coordinates": {
    "latitude": 7.7587155999999995,
    "longitude": 81.6525446
  },
  "address": "Kumpilamadu Road, Batticaloa 30000",
  "categories": [
    "Garden",
    "Tree farm"
  ],
  "phone": "0770087688",
  "hours": [
    {
      "day": "Monday",
      "times": [
        "9 AM–5 PM"
      ]
    },
    {
      "day": "Tuesday",
      "times": [
        "9 AM–5 PM"
      ]
    },
    {
      "day": "Wednesday",
      "times": [
        "9 AM–5 PM"
      ]
    },
    {
      "day": "Thursday",
      "times": [
        "9 AM–5 PM"
      ]
    },
    {
      "day": "Friday",
      "times": [
        "9 AM–5 PM"
      ]
    },
    {
      "day": "Saturday",
      "times": [
        "9 AM–5 PM"
      ]
    },
    {
      "day": "Sunday",
      "times": [
        "9 AM–5 PM"
      ]
    }
  ],
  "business_status": "OPEN",
  "id": "01M5W5PQH0GW8DBRA0W08QRF3W"
}
