{
  "name": "Harris Tailor",
  "coordinates": {
    "latitude": 7.6657952,
    "longitude": 81.73842789999999
  },
  "address": "MP8Q+897, Colombo - Batticaloa Hwy, Kattankudy",
  "categories": [
    "Men's tailor"
  ],
  "hours": [],
  "business_status": "OPEN",
  "id": "01M5W5PRCHK2T0PGTBRRS8DFBZ"
}
