{
  "name": "RR Communication",
  "coordinates": {
    "latitude": 7.734304,
    "longitude": 81.69395639999999
  },
  "address": "No.94 Kumarathan kovil Road, Batticaloa",
  "categories": [
    "Store"
  ],
  "phone": "0752156789",
  "hours": [
    {
      "day": "Monday",
      "times": [
        "9 AM–9 PM"
      ]
    },
    {
      "day": "Tuesday",
      "times": [
        "9 AM–9 PM"
      ]
    },
    {
      "day": "Wednesday",
      "times": [
        "9 AM–9 PM"
      ]
    },
    {
      "day": "Thursday",
      "times": [
        "9 AM–9 PM"
      ]
    },
    {
      "day": "Friday",
      "times": [
        "9 AM–9 PM"
      ]
    },
    {
      "day": "Saturday",
      "times": [
        "9 AM–9 PM"
      ]
    },
    {
      "day": "Sunday",
      "times": [
        "Closed"
      ]
    }
  ],
  "business_status": "OPEN",
  "id": "01M5W5PQK37TPF1XQJV9YV2264"
}
