{
  "name": "New Fashion Tailors",
  "coordinates": {
    "latitude": 7.6777928,
    "longitude": 81.73030539999999
  },
  "address": "17 Main St, Kattankudy",
  "categories": [
    "Clothing store"
  ],
  "phone": "0772300754",
  "hours": [
    {
      "day": "Monday",
      "times": [
        "6 AM–10 PM"
      ]
    },
    {
      "day": "Tuesday",
      "times": [
        "6 AM–10 PM"
      ]
    },
    {
      "day": "Wednesday",
      "times": [
        "6 AM–10 PM"
      ]
    },
    {
      "day": "Thursday",
      "times": [
        "6 AM–10 PM"
      ]
    },
    {
      "day": "Friday",
      "times": [
        "Closed"
      ]
    },
    {
      "day": "Saturday",
      "times": [
        "6 AM–10 PM"
      ]
    },
    {
      "day": "Sunday",
      "times": [
        "6 AM–10 PM"
      ]
    }
  ],
  "business_status": "OPEN",
  "id": "01M5W5PRD181EXBGKQ0BPSEVM5"
}
