{
  "name": "Jeyanthipuram Sri Kumaarathan Temple Batticaloa",
  "coordinates": {
    "latitude": 7.7318383,
    "longitude": 81.6886991
  },
  "categories": [
    "Hindu temple"
  ],
  "address": "PMJQ+PFP, Batticaloa",
  "phone": "0776117178",
  "business_status": "OPEN",
  "hours": [
    {
      "day": "Monday",
      "times": [
        "Open 24 hours"
      ]
    },
    {
      "day": "Tuesday",
      "times": [
        "Open 24 hours"
      ]
    },
    {
      "day": "Wednesday",
      "times": [
        "Open 24 hours"
      ]
    },
    {
      "day": "Thursday",
      "times": [
        "Open 24 hours"
      ]
    },
    {
      "day": "Friday",
      "times": [
        "Open 24 hours"
      ]
    },
    {
      "day": "Saturday",
      "times": [
        "Open 24 hours"
      ]
    },
    {
      "day": "Sunday",
      "times": [
        "Open 24 hours"
      ]
    }
  ],
  "id": "01M5Z5NB7519ZWXQWDZXMJ6681"
}
