{
  "name": "Salamath Jummah Mosque",
  "coordinates": {
    "latitude": 7.6750304,
    "longitude": 81.7327882
  },
  "address": "MPGM+247, Kattankudy",
  "categories": [
    "Mosque"
  ],
  "hours": [
    {
      "day": "Monday",
      "times": [
        "4:15–7 AM",
        "11:30 AM–8:30 PM"
      ]
    },
    {
      "day": "Tuesday",
      "times": [
        "4:15–7 AM",
        "11:30 AM–8:30 PM"
      ]
    },
    {
      "day": "Wednesday",
      "times": [
        "4:15–7 AM",
        "11:30 AM–8:30 PM"
      ]
    },
    {
      "day": "Thursday",
      "times": [
        "4:15–7 AM",
        "11:30 AM–8:30 PM"
      ]
    },
    {
      "day": "Friday",
      "times": [
        "4:15–7 AM",
        "11:30 AM–8:30 PM"
      ]
    },
    {
      "day": "Saturday",
      "times": [
        "4:15–7 AM",
        "11:30 AM–8:30 PM"
      ]
    },
    {
      "day": "Sunday",
      "times": [
        "4:15–7 AM",
        "11:30 AM–8:30 PM"
      ]
    }
  ],
  "business_status": "OPEN",
  "id": "01M5W5PR0TWNEXFCTXSDXPCWWD"
}
