{
  "name": "WEEVERS - The Fashion Store",
  "coordinates": {
    "latitude": 7.6839051,
    "longitude": 81.7269826
  },
  "address": "Main St, Kattankudy 30100",
  "categories": [
    "Clothing store"
  ],
  "phone": "0719528171",
  "hours": [
    {
      "day": "Monday",
      "times": [
        "10 AM–10 PM"
      ]
    },
    {
      "day": "Tuesday",
      "times": [
        "10 AM–10 PM"
      ]
    },
    {
      "day": "Wednesday",
      "times": [
        "10 AM–10 PM"
      ]
    },
    {
      "day": "Thursday",
      "times": [
        "10 AM–10 PM"
      ]
    },
    {
      "day": "Friday",
      "times": [
        "Closed"
      ]
    },
    {
      "day": "Saturday",
      "times": [
        "10 AM–10 PM"
      ]
    },
    {
      "day": "Sunday",
      "times": [
        "10 AM–10 PM"
      ]
    }
  ],
  "business_status": "OPEN",
  "id": "01M5W5PQQMQ03PPK6P776JTM3S"
}
