{
  "name": "Sweet Treats",
  "coordinates": {
    "latitude": 7.6791737,
    "longitude": 81.7237423
  },
  "categories": [
    "Dessert shop"
  ],
  "address": "Kattankudy",
  "business_status": "OPEN",
  "hours": [
    {
      "day": "Monday",
      "times": [
        "9 AM–5 PM"
      ]
    },
    {
      "day": "Tuesday",
      "times": [
        "9 AM–5 PM"
      ]
    },
    {
      "day": "Wednesday",
      "times": [
        "9 AM–5 PM"
      ]
    },
    {
      "day": "Thursday",
      "times": [
        "9 AM–5 PM"
      ]
    },
    {
      "day": "Friday",
      "times": [
        "9 AM–5 PM"
      ]
    },
    {
      "day": "Saturday",
      "times": [
        "9 AM–5 PM"
      ]
    },
    {
      "day": "Sunday",
      "times": [
        "9 AM–5 PM"
      ]
    }
  ],
  "id": "01M5ZAT0NJK1A1N5V2ZJVE74X0"
}
