{
  "name": "Dharus Salaam Mosque",
  "coordinates": {
    "latitude": 7.6795228,
    "longitude": 81.7322423
  },
  "address": "70/1 Rasa Alim Rd, Kattankudy",
  "categories": [
    "Mosque"
  ],
  "hours": [
    {
      "day": "Monday",
      "times": [
        "4:30 AM–8:30 PM"
      ]
    },
    {
      "day": "Tuesday",
      "times": [
        "4:30 AM–8:30 PM"
      ]
    },
    {
      "day": "Wednesday",
      "times": [
        "4:30 AM–8:30 PM"
      ]
    },
    {
      "day": "Thursday",
      "times": [
        "4:30 AM–8:30 PM"
      ]
    },
    {
      "day": "Friday",
      "times": [
        "4:30 AM–8:30 PM"
      ]
    },
    {
      "day": "Saturday",
      "times": [
        "4:30 AM–8:30 PM"
      ]
    },
    {
      "day": "Sunday",
      "times": [
        "4:30 AM–8:30 PM"
      ]
    }
  ],
  "business_status": "OPEN",
  "id": "01M5W5PQX09VNKCGW2YNDNDY1S"
}
