{
  "name": "GR Magic Pictures",
  "coordinates": {
    "latitude": 7.7173118999999994,
    "longitude": 81.7161745
  },
  "address": "Kallady",
  "categories": [
    "Photography service",
    "Graphic designer",
    "Photo booth",
    "Photo lab",
    "Film production company",
    "Video editing service"
  ],
  "phone": "0752822316",
  "hours": [
    {
      "day": "Monday",
      "times": [
        "9 AM–5 PM"
      ]
    },
    {
      "day": "Tuesday",
      "times": [
        "9 AM–5 PM"
      ]
    },
    {
      "day": "Wednesday",
      "times": [
        "9 AM–5 PM"
      ]
    },
    {
      "day": "Thursday",
      "times": [
        "9 AM–5 PM"
      ]
    },
    {
      "day": "Friday",
      "times": [
        "9 AM–5 PM"
      ]
    },
    {
      "day": "Saturday",
      "times": [
        "9 AM–5 PM"
      ]
    },
    {
      "day": "Sunday",
      "times": [
        "Closed"
      ]
    }
  ],
  "website": "https://www.facebook.com/grmagicpictures/",
  "business_status": "OPEN",
  "id": "01M5W5PRAS85KDZG70F0TX3RM6"
}
