{
  "name": "HayCell",
  "coordinates": {
    "latitude": 7.6867185,
    "longitude": 81.7253334
  },
  "address": "Colombo - Batticaloa Hwy, Kattankudy 30100",
  "categories": [
    "Cell phone store"
  ],
  "phone": "0770131988",
  "hours": [
    {
      "day": "Monday",
      "times": [
        "9 AM–9 PM"
      ]
    },
    {
      "day": "Tuesday",
      "times": [
        "9 AM–9 PM"
      ]
    },
    {
      "day": "Wednesday",
      "times": [
        "9 AM–9 PM"
      ]
    },
    {
      "day": "Thursday",
      "times": [
        "9 AM–9 PM"
      ]
    },
    {
      "day": "Friday",
      "times": [
        "Closed"
      ]
    },
    {
      "day": "Saturday",
      "times": [
        "9 AM–9 PM"
      ]
    },
    {
      "day": "Sunday",
      "times": [
        "9 AM–9 PM"
      ]
    }
  ],
  "business_status": "OPEN",
  "id": "01M5W5PQPQMXSPT513E3C6NSTR"
}
