{
  "name": "Silver jewel mart",
  "coordinates": {
    "latitude": 7.680180399999999,
    "longitude": 81.7291003
  },
  "address": "No09,New Kalmunai Road,New Kattankudy 06, Kattankudy 30100",
  "categories": [
    "Jewelry store"
  ],
  "phone": "0772381048",
  "hours": [
    {
      "day": "Monday",
      "times": [
        "10 AM–10 PM"
      ]
    },
    {
      "day": "Tuesday",
      "times": [
        "10 AM–10 PM"
      ]
    },
    {
      "day": "Wednesday",
      "times": [
        "10 AM–10 PM"
      ]
    },
    {
      "day": "Thursday",
      "times": [
        "10 AM–10 PM"
      ]
    },
    {
      "day": "Friday",
      "times": [
        "Closed"
      ]
    },
    {
      "day": "Saturday",
      "times": [
        "10 AM–10 PM"
      ]
    },
    {
      "day": "Sunday",
      "times": [
        "10 AM–10 PM"
      ]
    }
  ],
  "business_status": "OPEN",
  "id": "01M5W5PQTV5BCRPRWPK34C12CF"
}
