{
  "name": "Myni Trders",
  "coordinates": {
    "latitude": 7.678902,
    "longitude": 81.7328902
  },
  "address": "33A Dharussalam Road, Kattankudy 30100",
  "categories": [
    "Clothing store",
    "Clothing wholesaler"
  ],
  "phone": "0770064300",
  "hours": [
    {
      "day": "Monday",
      "times": [
        "10 AM–10 PM"
      ]
    },
    {
      "day": "Tuesday",
      "times": [
        "10 AM–10 PM"
      ]
    },
    {
      "day": "Wednesday",
      "times": [
        "10 AM–10 PM"
      ]
    },
    {
      "day": "Thursday",
      "times": [
        "10 AM–10 PM"
      ]
    },
    {
      "day": "Friday",
      "times": [
        "Closed"
      ]
    },
    {
      "day": "Saturday",
      "times": [
        "10 AM–10 PM"
      ]
    },
    {
      "day": "Sunday",
      "times": [
        "10 AM–10 PM"
      ]
    }
  ],
  "website": "https://mynionline.store/",
  "business_status": "OPEN",
  "id": "01M5W5PQFK1KQE81R1ZAVMSVE2"
}
