{
  "name": "Afrah Gallery",
  "coordinates": {
    "latitude": 7.6886382,
    "longitude": 81.725971
  },
  "address": "26, Elders Home Road, Kattankudy-01, Kattankudy 30100",
  "categories": [
    "Gift shop",
    "Digital printing service"
  ],
  "hours": [
    {
      "day": "Monday",
      "times": [
        "9 AM–10 PM"
      ]
    },
    {
      "day": "Tuesday",
      "times": [
        "9 AM–10 PM"
      ]
    },
    {
      "day": "Wednesday",
      "times": [
        "9 AM–10 PM"
      ]
    },
    {
      "day": "Thursday",
      "times": [
        "9 AM–10 PM"
      ]
    },
    {
      "day": "Friday",
      "times": [
        "Closed"
      ]
    },
    {
      "day": "Saturday",
      "times": [
        "9 AM–10 PM"
      ]
    },
    {
      "day": "Sunday",
      "times": [
        "9 AM–10 PM"
      ]
    }
  ],
  "business_status": "OPEN",
  "id": "01M5W5PQQFXB8HZ6JB579M2977"
}
