{
  "name": "Nikith Smart Cell",
  "coordinates": {
    "latitude": 7.666741399999999,
    "longitude": 81.7378052
  },
  "address": "MP8Q+M4V, Colombo - Batticaloa Hwy, Kattankudy",
  "categories": [
    "Phone repair service"
  ],
  "hours": [],
  "business_status": "OPEN",
  "id": "01M5W5PQWQED77NKH76AG0207E"
}
