{
  "name": "Science Study Centre, Kommathurai",
  "coordinates": {
    "latitude": 7.7941566,
    "longitude": 81.58265039999999
  },
  "categories": [
    "Education center"
  ],
  "address": "Chenkaladi",
  "phone": "0772283204",
  "business_status": "OPEN",
  "hours": [
    {
      "day": "Monday",
      "times": [
        "6 AM–7 PM"
      ]
    },
    {
      "day": "Tuesday",
      "times": [
        "6 AM–7 PM"
      ]
    },
    {
      "day": "Wednesday",
      "times": [
        "6 AM–7 PM"
      ]
    },
    {
      "day": "Thursday",
      "times": [
        "6 AM–7 PM"
      ]
    },
    {
      "day": "Friday",
      "times": [
        "6 AM–7 PM"
      ]
    },
    {
      "day": "Saturday",
      "times": [
        "6 AM–7 PM"
      ]
    },
    {
      "day": "Sunday",
      "times": [
        "6 AM–7 PM"
      ]
    }
  ],
  "id": "01M5Z7R0M4Y567J1B02BXKYD3Q"
}
